{
  "ramoira": {
    "spec_version": "3.2.0",
    "schema_type": "summary",
    "brand_id": "corvane",
    "schema_version": "1.0.0",
    "content_hash": "sha256:eed5c5f5102e2db46821d481259cc2884329bbff95bb30ac026b73db3a9808c2",
    "workflow_state": "in_review",
    "ratification": null,
    "account_owner_verified": false,
    "canonical_url": null,
    "summary_opt_in": []
  },
  "rules": [
    {
      "rule_id": "r_fear_vocabulary",
      "statement": "Never describe the pans with fear vocabulary about other cookware.",
      "check_class": "deterministic_exact",
      "severity": "absolute",
      "topic": "narrative.denotative.claims",
      "surfaces": "all",
      "markets": "all",
      "situations": "any",
      "modality": "text",
      "visibility": "public",
      "rationale": "Corvane sells on what the pan is, never on what other pans are alleged to contain.",
      "match": {
        "terms": [
          "non-toxic",
          "toxin-free",
          "chemical-free"
        ],
        "mode": "phrase",
        "normalization": "casefold_nfkc"
      },
      "provenance": "authored",
      "affirmed": true
    },
    {
      "rule_id": "r_warranty_wording",
      "statement": "Never call the warranty lifetime. It is 25 years.",
      "check_class": "deterministic_exact",
      "severity": "strong",
      "topic": "narrative.denotative.claims",
      "surfaces": "all",
      "markets": "all",
      "situations": "any",
      "modality": "text",
      "visibility": "public",
      "rationale": "The warranty terms say 25 years against cracking and warping. Anything longer is a claim Corvane cannot honour.",
      "match": {
        "terms": [
          "lifetime warranty",
          "lifetime guarantee",
          "guaranteed for life"
        ],
        "mode": "phrase",
        "normalization": "casefold_nfkc"
      },
      "provenance": "authored",
      "affirmed": true,
      "protects": [
        "c_warranty"
      ]
    },
    {
      "rule_id": "r_claims_approved",
      "statement": "Every product claim must be one of the approved claims, within its markets and surfaces.",
      "check_class": "deterministic_structural",
      "severity": "absolute",
      "topic": "narrative.denotative.claims",
      "surfaces": "all",
      "markets": "all",
      "situations": "any",
      "modality": "text",
      "visibility": "public",
      "rationale": null,
      "predicate": {
        "type": "claim_must_be_approved",
        "params": {
          "against": "/narrative/semiotic/denotative/claims"
        }
      },
      "provenance": "authored",
      "affirmed": true
    },
    {
      "rule_id": "r_owned_phrase_misquote",
      "statement": "Quote the owned phrase exactly: \"Made to be handed down.\"",
      "check_class": "deterministic_exact",
      "severity": "contextual",
      "topic": "identity.distinctiveAssets.linguistic.ownedPhrases",
      "surfaces": "all",
      "markets": "all",
      "situations": "any",
      "modality": "text",
      "visibility": "public",
      "rationale": "A near-miss weakens the phrase more than leaving it out.",
      "match": {
        "terms": [
          "made to be passed down",
          "built to be handed down",
          "made to hand down"
        ],
        "mode": "phrase",
        "normalization": "casefold_nfkc"
      },
      "provenance": "authored",
      "affirmed": true
    },
    {
      "rule_id": "r_self_reference",
      "statement": "Corvane refers to itself as \"we\", never in the third person.",
      "check_class": "deterministic_structural",
      "severity": "contextual",
      "topic": "identity.prism.relationship.pronoun",
      "surfaces": "all",
      "markets": "all",
      "situations": "any",
      "modality": "text",
      "visibility": "public",
      "rationale": null,
      "predicate": {
        "type": "self_reference_form",
        "params": {
          "form": "we",
          "brand_name": "Corvane"
        }
      },
      "provenance": "authored",
      "affirmed": true
    },
    {
      "rule_id": "r_no_exclamation",
      "statement": "No exclamation marks.",
      "check_class": "deterministic_structural",
      "severity": "contextual",
      "topic": "identity.distinctiveAssets.linguistic.typographicVoice",
      "surfaces": "all",
      "markets": "all",
      "situations": "any",
      "modality": "text",
      "visibility": "public",
      "rationale": "The pan does not need shouting about.",
      "predicate": {
        "type": "max_character_count",
        "params": {
          "character": "!",
          "max": 0
        }
      },
      "provenance": "authored",
      "affirmed": true
    },
    {
      "rule_id": "r_no_disposable_language",
      "statement": "Never use the vocabulary of disposability about cookware.",
      "check_class": "deterministic_exact",
      "severity": "contextual",
      "topic": "narrative.connotative",
      "surfaces": "all",
      "markets": "all",
      "situations": "any",
      "modality": "text",
      "visibility": "public",
      "rationale": "Inherited from the anchor archetype and kept by the owner.",
      "match": {
        "terms": [
          "disposable",
          "throwaway",
          "replace it every year"
        ],
        "mode": "phrase",
        "normalization": "casefold_nfkc"
      },
      "provenance": "inherited",
      "affirmed": true
    },
    {
      "rule_id": "r_not_a_gadget",
      "statement": "Never present the pan as a gadget, a hack or a shortcut.",
      "check_class": "judged_bounded",
      "severity": "strong",
      "topic": "narrative.connotative",
      "surfaces": "all",
      "markets": "all",
      "situations": "any",
      "modality": "text",
      "visibility": "public",
      "rationale": "The pan rewards use over years. Gadget framing promises the opposite.",
      "rubric": {
        "question": "Does this present the pan as a tool you grow into, or as a trick that saves effort?",
        "example_refs": [
          "ex_pdp_seasoning",
          "ex_pdp_gadget"
        ],
        "rail_refs": [],
        "term_refs": [
          "t_tool"
        ]
      },
      "provenance": "authored",
      "affirmed": true,
      "protects": [
        "pl_better_with_use",
        "t_tool"
      ]
    },
    {
      "rule_id": "r_no_invented_heritage",
      "statement": "Never invent heritage. Corvane was founded in 2014; no centuries-old, ancestral or grandmother framing.",
      "check_class": "judged_bounded",
      "severity": "strong",
      "topic": "identity.prism.culture",
      "surfaces": "all",
      "markets": "all",
      "situations": "any",
      "modality": "text",
      "visibility": "public",
      "rationale": "The old craft is real; Corvane's part in it is recent. Claiming otherwise is costume.",
      "rubric": {
        "question": null,
        "example_refs": [
          "ex_email_honest_age",
          "ex_email_heritage_costume"
        ],
        "rail_refs": [
          "rail_heritage"
        ]
      },
      "provenance": "authored",
      "affirmed": true,
      "protects": [
        "/identity/prism/culture/originNarrative"
      ]
    },
    {
      "rule_id": "r_social_formality_floor",
      "statement": "On social, formality never drops below 3 on the shared scale.",
      "check_class": "judged_bounded",
      "severity": "contextual",
      "topic": "identity.prism.relationship.formality",
      "surfaces": [
        "social_organic",
        "social_paid"
      ],
      "markets": "all",
      "situations": "any",
      "modality": "text",
      "visibility": "public",
      "rationale": null,
      "rubric": {
        "question": "Is this at least \"friendly but not informal\" (scale anchor 3)?",
        "example_refs": [
          "ex_social_ritual",
          "ex_social_hype"
        ],
        "rail_refs": []
      },
      "provenance": "authored",
      "affirmed": true
    },
    {
      "rule_id": "r_forbidden_colour",
      "statement": "Never use fluorescent green in brand visuals.",
      "check_class": "deterministic_exact",
      "severity": "contextual",
      "topic": "identity.distinctiveAssets.visual",
      "surfaces": "all",
      "markets": "all",
      "situations": "any",
      "modality": "visual",
      "visibility": "public",
      "rationale": null,
      "match": {
        "terms": [
          "#39FF14"
        ],
        "mode": "substring",
        "normalization": "casefold_nfkc"
      },
      "provenance": "authored",
      "affirmed": true
    },
    {
      "rule_id": "r_audio_tempo",
      "statement": "Brand audio stays between 70 and 110 bpm.",
      "check_class": "deterministic_structural",
      "severity": "contextual",
      "topic": "identity.distinctiveAssets.sonic",
      "surfaces": [
        "video_script",
        "audio_script"
      ],
      "markets": "all",
      "situations": "any",
      "modality": "audio",
      "visibility": "public",
      "rationale": null,
      "predicate": {
        "type": "tempo_range",
        "params": {
          "min_bpm": 70,
          "max_bpm": 110
        }
      },
      "provenance": "authored",
      "affirmed": true
    }
  ],
  "identity": {
    "prism": {
      "physique": {
        "permitted": [
          "dark carbon steel",
          "visible hammer and spin marks",
          "riveted handles",
          "patina as a feature"
        ],
        "posture": "A tool that looks better after ten years than on the first day."
      },
      "personality": {
        "characterBrief": "The workshop foreman who will tell you exactly how to season the pan, and will not pretend it is effortless."
      },
      "culture": {
        "coreValues": [
          "buy once, use for decades",
          "say what the pan does, and what it asks of you",
          "repair before replace"
        ],